{
  "$schema": "https://json-schema.org/draft/2020-12/schema",
  "$id": "https://justanotherrpggame.local/schemas/level.v5.json",
  "title": "Carte de JustAnotherRpgGame, format jadg-map version 5",
  "description": "Format de carte v5 (LOT-1018, D-51, D-52) : une seule description par carte, qui dit ce que Core joue (la grille de collision, les couches de pièces, les entités sur leurs cases, les étages) et ce que le moteur construit (terrain, objets en mètres, préfabriqués, lumières, ciel, navigation, groupe, cadrages). Écrite par scripts/maps/jadg_map.py sous sa forme canonique, lue par core::LevelLoader et par scripts/maps/build_level.py, relue d'un niveau retouché par scripts/maps/read_level.py, contrôlée par jadg_map.py --check. Repère : x vers l'est (les colonnes), y vers le sud (les lignes), z vers le haut, en mètres ; une case fait 1,5 m ; le coin de la case (0, 0) tombe en origin. Toute clé inconnue d'une couche ou d'une entité est une propriété libre.",
  "type": "object",
  "required": ["format", "version", "name", "width", "height", "tiles"],
  "properties": {
    "format": { "const": "jadg-map" },
    "version": { "const": 5 },
    "name": { "type": "string", "description": "Clé de traduction du nom de la carte (map.<identifiant>.name), ou un nom d'essai." },
    "comment": { "type": "string" },
    "place": { "type": "string", "description": "Le lieu, chemin dans l'arborescence des lieux (central-empire/capital/arenarea) : ses kits fournissent les pièces." },
    "width": { "type": "integer", "minimum": 1, "maximum": 1024 },
    "height": { "type": "integer", "minimum": 1, "maximum": 1024 },
    "origin": { "$ref": "#/$defs/point2", "description": "Où tombe le coin de la case (0, 0), en mètres." },
    "storeys": {
      "description": "Les étages praticables (D-51), le rez en tête à z = 0, puis chaque étage (au-dessus) ou sous-sol (en dessous) à sa hauteur, jamais deux à la même.",
      "type": "array",
      "minItems": 1,
      "items": {
        "type": "object",
        "required": ["name", "z"],
        "properties": { "name": { "type": "string" }, "z": { "type": "number" } },
        "additionalProperties": false
      }
    },
    "storeyLevels": { "type": "boolean", "description": "Vrai : le niveau construit se découpe en un niveau de chargement par étage, toujours chargé (D-51, LOT-1022) ; ses objets, ses couches et ses lumières y vont, le reste dans le niveau de la carte." },
    "groundHeightfield": {
      "description": "Altitudes du terrain urbain en mètres, lignes Y puis colonnes X ; même grille pour géométrie, placement et déplacements. Interpolation bilinéaire. Indépendante des étages de bâtiment.",
      "type": "object",
      "required": ["origin", "spacing", "width", "height", "heights"],
      "properties": {
        "origin": { "$ref": "#/$defs/point2" },
        "spacing": { "type": "array", "minItems": 2, "maxItems": 2, "items": { "type": "number", "exclusiveMinimum": 0 } },
        "width": { "type": "integer", "minimum": 2 },
        "height": { "type": "integer", "minimum": 2 },
        "heights": { "type": "array", "minItems": 4, "items": { "type": "number" } }
      },
      "additionalProperties": false
    },
    "storeyRegions": {
      "description": "Emprises locales des étages et des plateformes marchables (storey 0 pour un tablier ou une cour). minimum.z est le sol et maximum.z le plafond, en mètres absolus de carte.",
      "type": "array",
      "items": {
        "type": "object",
        "required": ["storey", "minimum", "maximum"],
        "properties": {
          "storey": { "type": "integer", "minimum": 0 },
          "minimum": { "$ref": "#/$defs/point3" },
          "maximum": { "$ref": "#/$defs/point3" }
        },
        "additionalProperties": false
      }
    },
    "nextEntityId": { "type": "integer", "minimum": 1 },
    "tiles": {
      "description": "La grille de collision du rez, entrée comprise : ce que Core joue. Absence = vide.",
      "type": "array",
      "items": { "$ref": "#/$defs/collisionTile" }
    },
    "forced": { "type": "array", "items": { "$ref": "#/$defs/cell" } },
    "layers": {
      "description": "Les couches de pièces posées sur les cases (la v4 migrée) : une pièce du kit du lieu par case.",
      "type": "array",
      "items": { "$ref": "#/$defs/layer" }
    },
    "entities": { "type": "array", "items": { "$ref": "#/$defs/entity" } },
    "terrain": { "$ref": "#/$defs/terrain" },
    "routes": {
      "description": "Les routes : une ligne brisée d'une largeur, peinte dans une couche de matière du terrain.",
      "type": "array",
      "items": {
        "type": "object",
        "required": ["name", "points", "width", "layer"],
        "properties": {
          "name": { "type": "string" },
          "points": { "type": "array", "minItems": 2, "items": { "$ref": "#/$defs/point2" } },
          "width": { "type": "number", "exclusiveMinimum": 0 },
          "layer": { "type": "string" }
        }
      }
    },
    "outlines": {
      "description": "Les contours : un polygone fermé, qui peint une couche de matière (layer), met le terrain à une hauteur (height) ou pose une eau (water, son niveau).",
      "type": "array",
      "items": {
        "type": "object",
        "required": ["name", "points"],
        "properties": {
          "name": { "type": "string" },
          "points": { "type": "array", "minItems": 3, "items": { "$ref": "#/$defs/point2" } },
          "layer": { "type": "string" },
          "height": { "type": "number" },
          "water": { "type": "number" }
        }
      }
    },
    "objects": { "type": "array", "items": { "$ref": "#/$defs/object" } },
    "fills": {
      "description": "Un dallage, tiré case par case entre plusieurs maillages, hors des ellipses qu'il exclut.",
      "type": "array",
      "items": {
        "type": "object",
        "required": ["id", "meshes", "cell", "areas"],
        "properties": {
          "id": { "type": "string" },
          "meshes": { "type": "array", "minItems": 1, "items": { "type": "string" } },
          "cell": { "type": "number", "exclusiveMinimum": 0 },
          "areas": { "type": "array", "items": { "type": "array", "minItems": 4, "maxItems": 4, "items": { "type": "number" } } },
          "excludeEllipses": { "type": "array", "items": { "type": "array", "minItems": 4, "maxItems": 4, "items": { "type": "number" } } }
        }
      }
    },
    "prefabs": {
      "description": "Les préfabriqués posés : un acteur composé, déclaré dans un fichier de Source/Elements/Editor/Prefabs/.",
      "type": "array",
      "items": {
        "type": "object",
        "required": ["id", "prefab", "position"],
        "properties": {
          "id": { "type": "string" },
          "prefab": { "type": "string" },
          "position": { "$ref": "#/$defs/point3" },
          "yaw": { "type": "number" },
          "scale": { "type": "number", "exclusiveMinimum": 0 }
        }
      }
    },
    "party": {
      "type": "object",
      "required": ["appearances"],
      "properties": {
        "appearances": { "type": "array", "items": { "type": "string" } },
        "walkSpeed": { "type": "number", "exclusiveMinimum": 0 },
        "heading": { "type": "number" }
      },
      "additionalProperties": false
    },
    "characters": {
      "description": "Les personnages qui ne sont ni du groupe ni une entité de Core, par leur maillage lié d'un kit : le lion de la porte, jusqu'au LOT-1025 (dette du LOT-1015).",
      "type": "array",
      "items": {
        "type": "object",
        "required": ["id", "mesh", "position", "idle", "walk"],
        "properties": {
          "id": { "type": "string" },
          "mesh": { "type": "string" },
          "position": { "$ref": "#/$defs/point3" },
          "heading": { "type": "number" },
          "idle": { "type": "string" },
          "walk": { "type": "string" },
          "walkSpeed": { "type": "number" },
          "patrol": { "type": "array", "items": { "$ref": "#/$defs/point3" } }
        }
      }
    },
    "assetsRoot": { "type": "string", "description": "Le dossier, relatif au dépôt, où se lisent les maillages à la place des kits (les données d'essai)." },
    "lighting": { "type": "object" },
    "daylight": { "type": "string" },
    "ground": {
      "type": "object",
      "required": ["colour", "size"],
      "properties": { "colour": { "type": "string" }, "size": { "type": "number" }, "height": { "type": "number" } }
    },
    "navigation": {
      "type": "object",
      "required": ["area", "height"],
      "properties": {
        "area": { "type": "array", "minItems": 4, "maxItems": 4, "items": { "type": "number" } },
        "height": { "type": "number", "exclusiveMinimum": 0 },
        "floor": { "type": "number" }
      }
    },
    "shots": {
      "type": "array",
      "items": {
        "type": "object",
        "required": ["id", "target", "heading", "pitch", "distance"],
        "properties": {
          "id": { "type": "string" },
          "target": { "$ref": "#/$defs/point3" },
          "heading": { "type": "number" },
          "pitch": { "type": "number" },
          "distance": { "type": "number", "exclusiveMinimum": 0 },
          "storey": { "type": "integer", "minimum": 0, "description": "L'étage que le cadrage regarde : les étages au-dessus de lui sont cachés pour sa capture." }
        }
      }
    },
    "hours": { "type": "array", "items": { "type": "string", "pattern": "^[0-2][0-9]:[0-5][0-9]$" } },
    "notes": {
      "type": "array",
      "items": {
        "type": "object",
        "required": ["text"],
        "properties": {
          "text": { "type": "string" },
          "x": { "type": "integer" },
          "y": { "type": "integer" },
          "storey": { "type": "integer", "minimum": 0 },
          "position": { "$ref": "#/$defs/point3" }
        }
      }
    }
  },
  "$defs": {
    "point2": { "type": "array", "minItems": 2, "maxItems": 2, "items": { "type": "number" } },
    "point3": { "type": "array", "minItems": 3, "maxItems": 3, "items": { "type": "number" } },
    "cell": {
      "type": "object",
      "required": ["x", "y"],
      "properties": { "x": { "type": "integer", "minimum": 0 }, "y": { "type": "integer", "minimum": 0 } },
      "additionalProperties": false
    },
    "tileType": {
      "enum": ["empty", "solid", "entry", "grass", "dirt", "sand", "water", "deepWater", "wall",
               "cliff", "bridge", "stairs", "pavement", "alley", "planks", "flagstone", "snow",
               "mud", "rubble", "door", "bush", "tree", "rock", "fence", "lowWall", "stall",
               "crate", "column", "roof", "tiers", "pit", "lava"]
    },
    "collisionTile": {
      "type": "object",
      "required": ["x", "y", "type"],
      "properties": {
        "x": { "type": "integer", "minimum": 0 },
        "y": { "type": "integer", "minimum": 0 },
        "type": { "$ref": "#/$defs/tileType" }
      },
      "additionalProperties": false
    },
    "layer": {
      "type": "object",
      "required": ["name", "kind"],
      "properties": {
        "name": { "type": "string" },
        "kind": { "enum": ["ground", "decor"] },
        "scene": { "type": "string" },
        "storey": { "type": "integer", "minimum": 0, "description": "L'étage praticable de la couche : ses pièces se posent dans son niveau de chargement, à sa hauteur plus z (LOT-1022)." },
        "z": { "type": "number", "description": "La hauteur où se posent les pièces de la couche, en mètres au-dessus du sol de son étage (l'étage de décor de la v4 migré)." },
        "tiles": {
          "type": "array",
          "items": {
            "type": "object",
            "required": ["x", "y", "type"],
            "properties": {
              "x": { "type": "integer", "minimum": 0 },
              "y": { "type": "integer", "minimum": 0 },
              "type": { "$ref": "#/$defs/tileType" },
              "piece": { "type": "string" }
            },
            "additionalProperties": false
          }
        }
      },
      "not": { "anyOf": [ { "required": ["floor"] } ] }
    },
    "volume": {
      "description": "Une boîte alignée sur les axes, en mètres dans le repère de la carte.",
      "type": "object",
      "required": ["min", "max"],
      "properties": { "min": { "$ref": "#/$defs/point3" }, "max": { "$ref": "#/$defs/point3" } },
      "additionalProperties": false
    },
    "entity": {
      "description": "Une entité : ce que Core joue, sur une case et à un étage. Ses propriétés libres sont celles de la famille (niveaux.md) ; appearance et heading sont lus par la construction (le personnage d'un PNJ, son cap).",
      "type": "object",
      "required": ["id", "type", "x", "y"],
      "properties": {
        "id": { "type": "string", "minLength": 1 },
        "type": { "type": "string", "minLength": 1 },
        "x": { "type": "integer", "minimum": 0 },
        "y": { "type": "integer", "minimum": 0 },
        "storey": { "type": "integer", "minimum": 0 },
        "volume": { "$ref": "#/$defs/volume" },
        "cells": { "type": "array", "items": { "$ref": "#/$defs/cell" } }
      },
      "not": { "anyOf": [ { "required": ["elevation"] } ] }
    },
    "object": {
      "description": "Un objet posé : un maillage (un .glb des kits ou des maîtres, relatif à Assets/ ou à assetsRoot), sa position, sa rotation, son échelle ; une lumière (light) ; l'entité qu'il montre (entity).",
      "type": "object",
      "required": ["id", "mesh", "position"],
      "properties": {
        "id": { "type": "string", "minLength": 1 },
        "mesh": { "type": "string" },
        "position": { "$ref": "#/$defs/point3" },
        "yaw": { "type": "number" },
        "pitch": { "type": "number" },
        "roll": { "type": "number" },
        "scale": { "oneOf": [ { "type": "number", "exclusiveMinimum": 0 }, { "$ref": "#/$defs/point3" } ] },
        "height": { "type": "number", "exclusiveMinimum": 0 },
        "storey": { "type": "integer", "minimum": 0 },
        "entity": { "type": "string" },
        "mirrored": { "type": "boolean" },
        "folder": { "type": "string" },
        "light": { "type": "object" }
      }
    },
    "terrain": {
      "description": "Le terrain : un Landscape dont les hauteurs et les couches de matière sont des images régénérées par build_level.py depuis cette description.",
      "type": "object",
      "required": ["area", "resolution", "layers"],
      "properties": {
        "area": { "type": "array", "minItems": 4, "maxItems": 4, "items": { "type": "number" } },
        "resolution": { "type": "number", "exclusiveMinimum": 0 },
        "base": { "type": "number" },
        "shapes": {
          "type": "array",
          "items": {
            "type": "object",
            "required": ["shape"],
            "properties": {
              "shape": { "enum": ["disc", "rect", "ramp"] },
              "centre": { "$ref": "#/$defs/point2" },
              "radius": { "type": "number" },
              "area": { "type": "array", "minItems": 4, "maxItems": 4, "items": { "type": "number" } },
              "from": { "$ref": "#/$defs/point2" },
              "to": { "$ref": "#/$defs/point2" },
              "width": { "type": "number" },
              "height": { "type": "number" },
              "heights": { "type": "array", "minItems": 2, "maxItems": 2, "items": { "type": "number" } },
              "falloff": { "type": "number", "minimum": 0 }
            }
          }
        },
        "layers": {
          "type": "array",
          "minItems": 1,
          "items": {
            "type": "object",
            "required": ["name", "colour"],
            "properties": { "name": { "type": "string" }, "colour": { "type": "string", "pattern": "^#[0-9a-fA-F]{6}$" } }
          }
        }
      }
    }
  }
}
